Tajuk Perolehan,Kategori Perolehan,Kementerian,Agensi,Nama Syarikat,Nilai Perolehan,Kriteria Rundingan Terus,Tarikh
"PERMOHONAN KELULUSAN KHAS BAGI PEROLEHAN PERKHIDMATAN PROMOSI DAN PUBLISITI DARIPADA BERITA NASIONAL MALAYSIA (BERNAMA) BAGI KEMPEN PROMOSI SKILLSMALAYSIA, JABATAN PEMBANGUNAN KEMAHIRAN SECARA RUNDINGAN TERUS",BEKALAN DAN PERKHIDMATAN BUKAN PERUNDING,KEMENTERIAN SUMBER MANUSIA,JABATAN PEMBANGUNAN KEMAHIRAN,PERTUBUHAN BERITA NASIONAL MALAYSIA,140000.00,Satu Punca Bekalan/ Perkhidmatan (Pembuat/ Pemegang Frachais),25/03/2013
PERMOHONAN PELANTIKAN STRATSEC.NET SDN. BHD. SECARA RUNDINGAN TERUS BAGI PENYEDIAAN PERKHIDMATAN PENILAIAN DAN PENSIJILAN PRODUK KESELAMATAN MAKLUMAT BERDASARKAN ISO/IEC 15408 (COMMON CRITERIA),PERKHIDMATAN BUKAN PERUNDING,"KEMENTERIAN SAINS, TEKNOLOGI DAN INOVASI",MALAYSIAN CYBER SECURITY AGENCY,STRATSEC.NET SDN BHD,784400.00,Satu Punca Bekalan/ Perkhidmatan (Pembuat/ Pemegang Frachais),25/03/2013
PERMOHONAN KELULUSAN PEROLEHAN SECARA RUNDINGAN TERUS STANDARD THGA GRAPHITE TUBES WITH END CAPS UNTUK MAKMAL PENCEMARAN INDUSTRI & PERSEKITARAN MAKANAN DAN MAKMAL LOGAM BERAT (1 JANUARI 2016 - 31 DISEMBER 2017),BEKALAN DAN PERKHIDMATAN BUKAN PERUNDING,KEMENTERIAN KESIHATAN,MAKMAL KESIHATAN AWAM KEBANGSAAN,PERKIN ELMER SDN. BHD.,94400.00,"SATU PUNCA (BEKALAN),            SATU PUNCA (PERKHIDMATAN),
PENYERAGAMAN",18/06/2015
PERMOHONAN KELULUSAN SECARA RUNDINGAN TERUS UNTUK PEMBELIAN LESEN/EJEN MIDDLEWARE/SISTEM PAYMATE DAN PENYELENGGARAAN SERTA PENAMBAHBAIKAN TERHADAPNYA DI KWSP SELAMA DUA (2) TAHUN MULAI OGOS 2015 HINGGA OGOS 2017,PERKHIDMATAN BUKAN PERUNDING,KEMENTERIAN KEWANGAN,KUMPULAN WANG SIMPANAN PEKERJA (KWSP),CYBER BUSINESS SOLUTIONS SDN. BHD.,236280.00,"PENYERAGAMAN,
KEPAKARAN",10/06/2015
"PERMOHONAN KELULUSAN SECARA RUNDINGAN TERUS REAGEN SUPERSCRIPT III PLATINUM ONE STEP QRT - PCR (0NVITROGEN, USA) UNTUK KEGUNAAN UNIT MOLEKUL SEKSYEN VIROLOGI (10 SEPTEMBER 2015 - 9 SEPTEMBER 2017)",BEKALAN DAN PERKHIDMATAN BUKAN PERUNDING,KEMENTERIAN KESIHATAN,MAKMAL KESIHATAN AWAM KEBANGSAAN,BIO-DIAGNOSTICS SDN BHD,1260000.00,"MENDESAK,
PENYERAGAMAN",28/05/2015
"PERMOHONAN PEROLEHAN SECARA RUNDINGAN TERUS BAGI REAGEN UJIAN ISOLASI KULTUR DAN SENSITIVITI MYCOBACTERIUM TUBERCULOSIS MENGGUNAKAN BACTEC MGIT UNTUK KEGUNAAN MAKMAL RUJUKAN TB KEBANGSAAN, BAHAGIAN PENYAKIT (4 JANUARI 2016 - 3 JANUARI 2019)",BEKALAN DAN PERKHIDMATAN BUKAN PERUNDING,KEMENTERIAN KESIHATAN,MAKMAL KESIHATAN AWAM KEBANGSAAN,BMS DIAGNOSTICS (M) SDN. BHD.,2738359.05,"SATU PUNCA (BEKALAN),             SATU PUNCA (PERKHIDMATAN)",27/05/2015
"PERMOHONAN RUNDINGAN TERUS BAGI MEMBEKAL DAN MENGHANTAR BAHAN GUNA HABIS DNA ANALYZER 3730XL KE PUSAT PENYELIDIKAN BIOTEKNOLOGI DAN NANOTEKNOLOGI, IBU PEJABAT MARDI, SERDANG MULAI 7 SEPTEMBER 2015 HINGGA 5 OKTOBER 2015",BEKALAN,KEMENTERIAN PERTANIAN DAN INDUSTRI ASAS TANI,INSTITUT PENYELIDIKAN DAN KEMAJUAN PERTANIAN MALAYSIA (MARDI),ANALISA RESOURCES (M) SDN. BHD.,939874.00,SATU PUNCA (BEKALAN),22/05/2015
PERMOHONAN PEROLEHAN SECARA RUNDINGAN TERUS BAGI PEMBEKALAN REAGEN GENOTYPE MTBDRPLUS DAN GENOTYPE MYCOBACTERIUM TUBERCULOSIS SPECIES UNTUK KEGUNAAN SEKSYEN TIBI & KUSTA (10 SEPTEMBER 2015 - 9 SEPTEMBER 2017),BEKALAN DAN PERKHIDMATAN BUKAN PERUNDING,KEMENTERIAN KESIHATAN,MAKMAL KESIHATAN AWAM KEBANGSAAN,BIO-FOCUS SAINTIFIK SDN. BHD.,676000.00,"SATU PUNCA (BEKALAN),             SATU PUNCA (PERKHIDMATAN)",21/05/2015
PERMOHONAN KELULUSAN KUMPULAN WANG SIMPANAN PEKERJA (KWSP) BAGI CADANGAN PELANTIKAN SYARIKAT EPROTEA MSC SDN. BHD. SECARA RUNDINGAN TERUS BAGI PELAKSANAAN NEW RENTAS SYSTEM (BERDASARKAN ARAHAN BANK NEGARA MALAYSIA) DENGAN TEMPOH SIAP SEHINGGA 31 OKTOBER 2015,PERKHIDMATAN BUKAN PERUNDING,KEMENTERIAN KEWANGAN,KUMPULAN WANG SIMPANAN PEKERJA (KWSP),EPROTEA MSC SDN. BHD.,103925.00,SATU PUNCA (PERKHIDMATAN),12/05/2015
PERMOHONAN UNTUK MELAKSANAKAN PEROLEHAN SECARA RUNDINGAN TERUS BAGI PERKHIDMATAN PENYELENGGARAAN SISTEM PERAKAUNAN STANDARD ACCOUNTING SYSTEM FOR GOVERNMENT AGENCIES (SAGA) SURUHANJAYA KOPERASI MALAYSIA (SKM) MULAI 1 JANUARI 2015 HINGGA 31 DISEMBER 2017,PERKHIDMATAN BUKAN PERUNDING,"KEMENTERIAN PERDAGANGAN DALAM NEGERI, KOPERASI DAN KEPENGGUNAAN",SURUHANJAYA KOPERASI MALAYSIA (SKM),CENTURY SOFTWARE (MALAYSIA) SDN. BHD.,1154988.00,"MENDESAK,           SATU PUNCA (PERKHIDMATAN), PENYERAGAMAN",12/05/2015
PERMOHONAN PEROLEHAN SECARA RUNDINGAN TERUS BAGI PROJEK PENAMBAHBAIKAN SISTEM BAHAGIAN AUDIT KOPERASI SURUHANJAYA KOPERASI MALAYSIA TAHUN 2015 BAGI TEMPOH SATU TAHUN MULAI 6 OGOS 2015 HINGGA 5 OGOS 2016,PERKHIDMATAN BUKAN PERUNDING,"KEMENTERIAN PERDAGANGAN DALAM NEGERI, KOPERASI DAN KEPENGGUNAAN",TIADA AGENSI,TULINO MANAGEMENT SOLUTIONS SDN. BHD.,264150.00,"MENDESAK,
PENYERAGAMAN,
BUMIPUTERA (PEMBUAT),
KEPAKARAN",12/05/2015
PERMOHONAN KELULUSAN BAGI RUNDINGAN TERUS PENAMBAHBAIKAN SISTEM ELECTRONIC AUDIT RATING SYSTEM (EARAS)JABATAN AUDIT NEGARA TEMPOH DUA  TAHUN MULAI 14 JULAI 2015 SEHINGGA 13 JULAI 2017,PERKHIDMATAN BUKAN PERUNDING,JABATAN PERDANA MENTERI,JABATAN AUDIT NEGARA,KOMETSOFT (M) SDN. BHD.,128631.00,PENYERAGAMAN,11/05/2015
PERMOHONAN TAMBAHAN NILAI BAGI PERJANJIAN PERKHIDMATAN PENYENGGARAAN GOVERNMENT FINANCIAL MANAGEMENT ACCOUNTING SYSTEM (GFMAS),PERKHIDMATAN BUKAN PERUNDING,KEMENTERIAN KEWANGAN,JABATAN AKAUNTAN NEGARA MALAYSIA,TELITI COMPUTERS SDN. BHD.,200000.00,Penyeragaman,22/03/2013
"PERMOHONAN PEROLEHAN SECARA RUNDINGAN TERUS BAGI PERKHIDMATAN SEWAAN PERALATAN TEKNIKAL, PAKEJ MESYUARAT DAN PENGINAPAN DENGAN THR HOTEL (KL) SDN. BHD. BAGI PENGANJURAN MESYUARAT KE-40 ASEAN CONSULTATIVE COMMITTEE FOR STANDARDS AND QUALITY (ACCSQ) DAN INDUSTRY BREAKFAST FORUM WITH LEADERS OF ISO AND IEC",BEKALAN DAN PERKHIDMATAN BUKAN PERUNDING,"KEMENTERIAN SAINS, TEKNOLOGI DAN INOVASI",JABATAN STANDARD MALAYSIA,THR HOTEL (KL) SDN. BHD.,129050.80,Keperluan Mendesak,20/03/2013
"PROJEK MENAIK TARAF TERMINAL PENUMPANG DAN JETI, PEMBINAAN BANGUNAN CIQ DAN JETI BARU DI JETI KUAH, LANGKAWI, KEDAH",KERJA,KEMENTERIAN KERJA RAYA,JABATAN KERJA RAYA MALAYSIA (JKR),UZAIMIN ENTERPRISE (ALOR SETAR) SDN. BHD.,86500000.00,Keperluan Mendesak,20/03/2013
"MEMOHON KELULUSAN KHAS PERBENDAHARAAN UNTUK MELANTIK STORY CIRCLE SEBAGAI SYARIKAT PENGENDALI LATIHAN BAGI PROGRAM BAREFOOT LEADERSHIP CIRCLE DENGAN ANGGARAN KOS RM285,000.00",PERKHIDMATAN BUKAN PERUNDING,KEMENTERIAN PERDAGANGAN ANTARABANGSA DAN INDUSTRI,,STORY CIRCLE,255000.00,Kepakaran,14/03/2013
"KERJA-KERJA MENGOPERASI DAN MENELENGGARA LOJI INSINERATOR PULAU LANGKAWI,KEDAH",KERJA,"KEMENTERIAN KESEJAHTERAAN BANDAR, PERUMAHAN DAN KERAJAAN TEMPATAN",JABATAN PENGURUSAN SISA PEPEJAL NEGARA,XCN TECHNOLOGY SDN BHD,7441607.00,Penyeragaman,14/03/2013
PERMOHONAN KELULUSAN RUNDINGAN TERUS BAGI CADANGAN PERKHIDMATAN PENYELENGGARAAN DAN PEMBAIKAN SECARA KOMPREHENSIF LIF-LIF PENUMPANG JENAMA EITA DAN TOSHIBA DI UITM CAWANGAN PULAU PINANG UNTUK TEMPOH TIGA (3) TAHUN,BEKALAN DAN PERKHIDMATAN BUKAN PERUNDING,KEMENTERIAN PENDIDIKAN TINGGI,,"EITA ELEVATOR (MALAYSIA) SDN. BHD., MS ELEVATORS ENGINEERING SDN. BHD.",200880.00,Keperluan Mendesak,07/03/2013
PERMOHONAN PELANJUTAN KONTRAK BAGI PELAKSANAAN DAN PERLUASAN PROJEK MALAYSIA EMERGENCY RESPONSE SERVICES 999 (MERS 999) UNTUK TAHUN 2013 HINGGA 2014 DENGAN TELEKOM MALAYSIA BHD (TM),BEKALAN DAN PERKHIDMATAN BUKAN PERUNDING,KEMENTERIAN KOMUNIKASI DAN MULTIMEDIA,,TELEKOM MALAYSIA BERHAD,233000000.00,"Penyeragaman, Satu Punca Bekalan/ Perkhidmatan (Pembuat/ Pemegang Frachais)",06/03/2013
"PERMOHONAN PEROLEHAN SECARA RUNDINGAN TERUS BAGI PENYELENGGARAAN SISTEM ILMU, PUSAT SUMBER KEMENTERIAN PERDAGANGAN ANTARABANGSA DAN INDUSTRI (MITI)",PERKHIDMATAN BUKAN PERUNDING,KEMENTERIAN PERDAGANGAN ANTARABANGSA DAN INDUSTRI,,PARADIGM SYSTEMS BERHAD,75000.00,"Satu Punca Bekalan/ Perkhidmatan (Pembuat/ Pemegang Frachais), Penyeragaman",06/03/2013
PERMOHONAN KELULUSAN PEROLEHAN SECARA RUNDINGAN TERUS UNTUK MENDAPATKAN PERKHIDMATAN MENJALANKAN KURSUS BERIMPAK TINGGI DALAM MELAKSANAKAN DASAR TRANSFORMASI PENDIDIKAN VOKASIONAL 2013 OLEH RANACO MARINE SDN. BHD. DAN KRU ACADEMY SDN. BHD. BAGI PROJEK USAHA SAMA SEKTOR AWAM SWASTA KEPADA KPM BAGI TEMPOH TUJUH (7) TAHUN,PERKHIDMATAN BUKAN PERUNDING,KEMENTERIAN PENDIDIKAN MALAYSIA,BAHAGIAN PENDIDIKAN TEKNIK DAN VOKASIONAL,"KRU ACADEMY SDN. BHD. (KEPAKARAN : MULTIMEDIA-ANIMATOR), RANACO MARINE SDN. BHD. (KEPAKARAN : LATIHAN MARITIM)",62366400.00,Kepakaran,28/02/2013
PERMOHONAN PEROLEHAN SECARA RUNDINGAN TERUS BAGI PERKHIDMATAN PENYEWAAN AMBULAN LAUT HOSPITAL LANGKAWI DENGAN SYARIKAT JMV TRADETECH SDN. BHD. UNTUK TEMPOH TIGA (3) TAHUN DAN OPSYEN PELANJUTAN DUA (2) TAHUN,BEKALAN DAN PERKHIDMATAN BUKAN PERUNDING,KEMENTERIAN KESIHATAN,,JMV TRADETECH SDN. BHD.,4680000.00,Keperluan Mendesak,28/02/2013
PERMOHONAN KELULUSAN KHAS KEMENTERIAN KEWANGAN MELALUI PEGAWAI PENGAWAL BAGI PEROLEHAN SECARA RUNDINGAN TERUS PERKHIDMATAN MEMBEKAL DAN MENGHANTAR MAKANAN BERMASAK UNTUK TAHANAN DI PUSAT TAHANAN SEMENTARA (PTS) DI KOTA KINABALU BAGI MAJLIS KESELAMATAN NEGARA UNTUK TEMPOH SELAMA ENAM  BULAN MULAI 19 JUN 2015 SEHINGGA 19 DISEMBER 2015.,BEKALAN DAN PERKHIDMATAN BUKAN PERUNDING,JABATAN PERDANA MENTERI,MAJLIS KESELAMATAN NEGARA (MKN),AMIN JAYA ENTERPRISE,2442240.00,MENDESAK,11/05/2015
PERMOHONAN KELULUSAN PELANTIKAN RUNDINGAN TERUS BAGI TUJUAN SEWAAN DEWAN UNTUK JUALAN TERUS DARI KILANG MULAI 3 JUN 2015 HINGGA 8 JUN 2015,PERKHIDMATAN BUKAN PERUNDING,"KEMENTERIAN PERDAGANGAN DALAM NEGERI, KOPERASI DAN KEPENGGUNAAN",TIADA AGENSI,MELAKA INTERNATIONAL TRADE CENTRE SDN. BHD.,140804.04,SATU PUNCA (PERKHIDMATAN),21/04/2015
"PROGRAM PENEMPATAN SEMENTARA MANGSA BANJIR DI 200 UNIT PPRM GUA MUSANG OLEH KEMENTERIAN KESEJAHTERAAN BANDAR, PERUMAHAN DAN KERAJAAN TEMPATAN (KPKT)                     
I) PERMOHONAN PEROLEHAN SECARA RUNDINGAN TERUS BAGI PEROLEHAN MEMBEKAL DAN MEMASANG 200 BUAH KATIL DAN TILAM SAIZ QUEEN SERTA 400 BUAH KATIL DAN TILAM SAIZ BUJANG; DAN  
II) PERMOHONAN PEROLEHAN SECARA RUNDINGAN TERUS BAGI PEROLEHAN MEMBEKAL, MEMASANG, MENGUJI DAN MENTAULIAH 2,000 UNIT LAMPU DAN 800 UNIT KIPAS",BEKALAN DAN PERKHIDMATAN BUKAN PERUNDING,"KEMENTERIAN KESEJAHTERAAN BANDAR, PERUMAHAN DAN KERAJAAN TEMPATAN",JABATAN PERUMAHAN NEGARA,"KABIMAS MANUFACTURING SDN. BHD.,                 MULTIMEDIA COMMUNICATION",511000.00,"MENDESAK, BUMIPUTERA (PEMBUAT), KEPAKARAN",14/04/2015
"PERMOHONAN PEROLEHAN SECARA RUNDINGAN TERUS BAGI PERKHIDMATAN PEMBANGUNAN DAN PELAKSANAAN PORTAL ORANG-E BAHAGIAN KESEJAHTERAAN BANDAR (BKS), KEMENTERIAN KESEJAHTERAAN BANDAR, PERUMAHAN DAN KERAJAAN TEMPATAN (KPKT) BAGI TEMPOH 30 BULAN",PERKHIDMATAN BUKAN PERUNDING,"KEMENTERIAN KESEJAHTERAAN BANDAR, PERUMAHAN DAN KERAJAAN TEMPATAN",TIADA AGENSI,JRJ MANAGEMENT CONSULTANTS SDN. BHD.,4173750.00,MENDESAK,26/03/2015
PERMOHONAN KELULUSAN KHAS PERBENDAHARAAN BAGI PEROLEHAN RUNDINGAN TERUS PERKHIDMATAN PENYELENGGARAAN SISTEM ACCOUNTING FOR GOVERNMENT AGENCIES DI LEMBAGA PENDUDUK DAN PEMBANGUNAN KELUARGA NEGARA (LPPKN) BAGI TEMPOH DUA TAHUN MULAI 1 JANUARI 2015 SEHINGGA 31 DISEMBER 2016,PERKHIDMATAN BUKAN PERUNDING,"KEMENTERIAN PEMBANGUNAN WANITA, KELUARGA DAN MASYARAKAT",LEMBAGA PENDUDUK DAN PEMBANGUNAN KELUARGA NEGARA (LPPKN),CENTURY SOFTWARE (MALAYSIA) SDN. BHD.,430220.00,"MENDESAK, PENYERAGAMAN",26/03/2015
"PERMOHONAN MELAKSANAKAN PEROLEHAN PERALATAN PERUBATAN IMBASAN COMPUTED TOMOGRAPHY (CT SCAN) 16 SLICES BAGI JABATAN PENGIMEJAN DAN DIAGNOSTIK, HOSPITAL AMPANG SECARA RUNDINGAN TERUS",BEKALAN,KEMENTERIAN KESIHATAN,HOSPITAL AMPANG,METRO JENDELA SDN. BHD.,2607420.00,"MENDESAK, PENYERAGAMAN",24/03/2015
PERMOHONAN PEROLEHAN SECARA RUNDINGAN TERUS RAPID TEST KIT FILARIASIS (PANFL RAPID) BAGI TEMPOH ENAM BULAN (10 JUN 2015 - 31 DISEMBER 2015),BEKALAN DAN PERKHIDMATAN BUKAN PERUNDING,KEMENTERIAN KESIHATAN,KEMENTERIAN KESIHATAN MALAYSIA,BIO ETC SDN BHD,186965.00,"MENDESAK,           SATU PUNCA (BEKALAN)",19/03/2015
PEROLEHAN TAMBAHAN LESEN PERISIAN IBM BAGI PERLUASAN PERLAKSANAAN APLIKASI PEMPROFAILAN PEMBAYAR CUKAI 360-DEGREE DI LEMBAGA HASIL DALAM NEGERI MALAYSIA SECARA RUNDINGAN TERUS DENGAN PRISMA KHAS SDN. BHD. BAGI TEMPOH TIGA TAHUN DUA BULAN MULAI 1 JUN 2015 HINGGA 31 JULAI 2018,BEKALAN DAN PERKHIDMATAN BUKAN PERUNDING,KEMENTERIAN KEWANGAN,LEMBAGA HASIL DALAM NEGERI (LHDN),PRISMA KHAS SDN. BHD.,3320000.00,"PENYERAGAMAN, KEPAKARAN",17/03/2015
KURSUS PLAYGROUND SAFETY INSPECTOR CERTIFICATION (CPSI) COURSE & EXAMINATION PADA 25 HINGGA 31 MAC 2015 DI PUTRAJAYA ANJURAN PERBADANAN PUTRAJAYA DENGAN PERTUBUHAN KESELAMATAN TAMAN PERMAINAN MALAYSIA (PSAM),PERKHIDMATAN BUKAN PERUNDING,KEMENTERIAN WILAYAH PERSEKUTUAN,PERBADANAN PUTRAJAYA,PERTUBUHAN KESELAMATAN TAMAN PERMAINAN MALAYSIA (PSAM),52900.00,KEPAKARAN,17/03/2015
PEROLEHAN PERKHIDMATAN SISTEM PEROLEHAN BERELETRONIK BAGI MODUL EBIDDING DI LEMBAGA HASIL DALAM NEGERI MALAYSIA SECARA RUNDINGAN TERUS DENGAN COMMERCE DOT COM SDN. BHD. UNTUK TEMPOH DUA TAHUN MULAI 1 JUN 2015 HINGGA 31 MEI 2017,PERKHIDMATAN BUKAN PERUNDING,KEMENTERIAN KEWANGAN,LEMBAGA HASIL DALAM NEGERI (LHDN),COMMERCE DOT COM SDN. BHD.,98580.00,PENYERAGAMAN,13/03/2015
PERMOHONAN KELULUSAN BAGI CADANGAN PELANTIKAN SSDM SOFTWARE SDN. BHD. SECARA RUNDINGAN TERUS BAGI PENAMBAHBAIKAN FUNGSI KIOSK BAGI TAHUN 2015 DI KUMPULAN WANG SIMPANAN PEKERJA (KWSP) DENGAN TEMPOH SIAP 81 'MANDAYS',PERKHIDMATAN BUKAN PERUNDING,KEMENTERIAN KEWANGAN,KUMPULAN WANG SIMPANAN PEKERJA (KWSP),SSDM SOFTWARE SDN. BHD.,97880.00,PENYERAGAMAN,13/03/2015
PERMOHONAN UNTUK MELAKSANAKAN PEROLEHAN SECARA RUNDINGAN TERUS BAGI PERKHIDMATAN PROGRAM SEKOLAH TRANSFORMASI UNTUK KEMENTERIAN PENDIDIKAN MALAYSIA BAGI TEMPOH 1 JUN 2015 SEHINGGA 31 JULAI 2016,BEKALAN DAN PERKHIDMATAN BUKAN PERUNDING,KEMENTERIAN PENDIDIKAN MALAYSIA,BAHAGIAN PENGURUSAN SEKOLAH HARIAN,LEAPED SERVICES SDN BHD,13500000.00,"PENYERAGAMAN, KEPAKARAN",13/03/2015
PERMOHONAN KELULUSAN CADANGAN PELANTIKAN SYARIKAT GI SOLUTION GATEWAY SDN. BHD. BAGI PERKHIDMATAN PENYELENGGARAAN PERISIAN PFS DAN AFIS DI KUMPULAN WANG SIMPANAN PEKERJA (KWSP) SECARA RUNDINGAN TERUS BAGI TEMPOH LIMA  TAHUN MULAI 1 JULAI 2015 HINGGA 30 JUN 2020,PERKHIDMATAN BUKAN PERUNDING,KEMENTERIAN KEWANGAN,KUMPULAN WANG SIMPANAN PEKERJA (KWSP),GI SOLUTIONS GATEWAYS SDN. BHD.,38219797.78,PENYERAGAMAN,12/03/2015
PERMOHONAN PEROLEHAN PENGHASILAN PROTOTAIP JAMBATAN MUDAH ALIH (FOREST MOBILE BRIDGE - FMB) SECARA RUNDINGAN TERUS UNTUK TEMPOH 15 MEI 2015 HINGGA 14 JULAI 2015,BEKALAN DAN PERKHIDMATAN BUKAN PERUNDING,KEMENTERIAN SUMBER ASLI DAN ALAM SEKITAR,INSTITUT PENYELIDIKAN PERHUTANAN MALAYSIA (FRIM),F&G SOLUTIONS SDN BHD,93300.00,"SATU PUNCA (PERKHIDMATAN), KEPAKARAN",10/03/2015
PERMOHONAN KELULUSAN PEROLEHAN SECARA RUNDINGAN TERUS BAGI PROGRAM LATIHAN PETUGAS BARISAN HADAPAN DAN TRAIN THE TRAINER INISIATIF STRATEGI LAUTAN BIRU KEBANGSAAN (NBOS) 1MALAYSIA CUSTOMER SERVICE OF CIVIL SERVANTS (1SERVE) DENGAN TEMPOH KONTRAK SELAMA 8 MINGGU MULAI 31 MAC 2015 HINGGA 30 MEI 2015,PERKHIDMATAN BUKAN PERUNDING,JABATAN PERDANA MENTERI,JABATAN PERKHIDMATAN AWAM,FAARA TRAINING RESOURCES,226000.00,PENYERAGAMAN,09/03/2015
"PEROLEHAN JABATAN KASTAM DIRAJA MALAYSIA (JKDM) BAGI PROJEK PENAMBAHBAIKAN SISTEM MAKLUMAT KASTAM (SMK), SISTEM AUTHORISED ECONOMIC OPERATOR (AEO) DAN SISTEM EDI COMMUNICATION SERVER (ECS) UNTUK PELAKSANAAN GOODS AND SERVICES TAX (GST) BAGI TEMPOH PELAKSANAAN SELAMA SATU  TAHUN MULAI 31 MAC 2015 HINGGA 30 MAC 2016",PERKHIDMATAN BUKAN PERUNDING,KEMENTERIAN KEWANGAN,JABATAN KASTAM DIRAJA MALAYSIA,EDARAN IT SERVICES SDN BHD,485000.00,"MENDESAK, PENYERAGAMAN",03/03/2015
"PERKHIDMATAN PENAMBAHBAIKAN SISTEM TERAS KWSP (PROVIDENT FUND SYSTEM, PFS)BAGI MEWUJUDKAN PENGENDALIAN KWSP-ISLAMIK UNTUK TEMPOH 15 BULAN MULAI 1 OKTOBER 2015 HINGGA 31 DISEMBER 2016 DAN PERKHIDMATAN PENYELENGGARAAN UNTUK TEMPOH TIGA TAHUN",PERKHIDMATAN BUKAN PERUNDING,KEMENTERIAN KEWANGAN,KUMPULAN WANG SIMPANAN PEKERJA (KWSP),SYMPHONY SOLUTIONS GATEWAY SDN. BHD.,13409000.00,"SATU PUNCA (PERKHIDMATAN), PENYERAGAMAN",03/03/2015
PEMBANGUNAN AIRTIME REVENUE MANAGEMENT SYSTEM (ARMS) KEMENTERIAN KOMUNIKASI DAN MULTIMEDIA (KKMM) UNTUK TEMPOH 15 JUN 2015 HINGGA 14 JUN 2018,PERKHIDMATAN BUKAN PERUNDING,KEMENTERIAN KOMUNIKASI DAN MULTIMEDIA,BAHAGIAN KEWANGAN,RENTAK SETIA SDN. BHD.,5601596.00,"MENDESAK,            SATU PUNCA (PERKHIDMATAN), PENYERAGAMAN",03/03/2015
PERMOHONAN RUNDINGAN TERUS BAGI PELANTIKAN SYARIKAT GHA EVENTS SDN. BHD SEBAGAI PEMBEKAL PERKHIDMATAN UNTUK PENGURUSAN DAN KEPERLUAN LOGISTIK SERTA TEKNIKAL PROGRAM CRAFT INTERNATIONAL FESTIVAL (CIF) 2015,PERKHIDMATAN BUKAN PERUNDING,KEMENTERIAN PELANCONGAN DAN KEBUDAYAAN MALAYSIA,TIADA AGENSI,GHA EVENTS SDN. BHD,2706522.00,"MENDESAK, KEPAKARAN",24/02/2015
"PERMOHONAN BAGI PERKHIDMATAN MEMBEKAL, MEMASANG, MENGUJI, MENTAULIAH, MENAIK TARAF, MENYENGGARA DAN MENYEDIAKAN KHIDMAT SOKONGAN UNTUK SISTEM PERAKAUNAN HASIL BERELEKTRONIK (ERAS) DI LEMBAGA HASIL DALAM NEGERI MALAYSIA SECARA RUNDINGAN TERUS DENGAN CENTURY SOFTWARE (M) SDN. BHD. (CENSOF)",BEKALAN DAN PERKHIDMATAN BUKAN PERUNDING,KEMENTERIAN KEWANGAN,LEMBAGA HASIL DALAM NEGERI (LHDN),CENTURY SOFTWARE (MALAYSIA) SDN. BHD.,6100000.00,Satu Punca Bekalan/ Perkhidmatan (Pembuat/ Pemegang Frachais),26/02/2013
PERMOHONAN RUNDINGAN TERUS SEBAGAI PEMBEKAL PERKHIDMATAN UNTUK PENGURUSAN ACARA DAN KEPERLUAN LOGISTIK SERTA TEKNIKAL PROGRAM CRAFT INTERNATIONAL FESTIVAL (CIF) 2015 MULAI 10 SEPTEMBER 2015 HINGGA 13 SEPTEMBER 2015,PERKHIDMATAN BUKAN PERUNDING,KEMENTERIAN PELANCONGAN DAN KEBUDAYAAN MALAYSIA,TIADA AGENSI,GHA EVENTS SDN BHD,2706522.00,KEPAKARAN,24/02/2015
"PROGRAM PERUMAHAN RAKYAT (PPR) JABATAN PERUMAHAN NEGARA, KPKT SECARA RUNDINGAN TERUS BAGI PPR KOTA SETAR, ALOR SETAR, KEDAH
BIL UNIT : 500 UNIT
TEMPOH PEMBINAAN : 36 BULAN",KERJA,"KEMENTERIAN KESEJAHTERAAN BANDAR, PERUMAHAN DAN KERAJAAN TEMPATAN",JABATAN PERUMAHAN NEGARA,TULANGIS MAJU SDN. BHD.,95000000.00,Keperluan Mendesak,25/02/2013
"PROGRAM PERUMAHAN RAKYAT (PPR) JABATAN PERUMAHAN NEGARA, KPKT SECARA RUNDINGAN TERUS BAGI PPR DIMILIKI DIPAYA RUMPUT, MELAKA TENGAH, MELAKA
BIL. UNIT : 600 UNIT
TEMPOH PEMBINAAN : 36 BULAN",KERJA,"KEMENTERIAN KESEJAHTERAAN BANDAR, PERUMAHAN DAN KERAJAAN TEMPATAN",JABATAN PERUMAHAN NEGARA,GEMAWAN BINA SDN. BHD.,101000000.00,Keperluan Mendesak,25/02/2013
"PROGRAM PERUMAHAN RAKYAT (PPR) JABATAN PERUMAHAN NEGARA, KPKT SECARA RUNDINGAN TERUS BAGI PPR KOTA BHARU, KELANTAN
BIL UNIT : 1,000 UNIT
TEMPOH PEMBINAAN : 36 BULAN",KERJA,"KEMENTERIAN KESEJAHTERAAN BANDAR, PERUMAHAN DAN KERAJAAN TEMPATAN",JABATAN PERUMAHAN NEGARA,INSPIRASI PERKASA SDN. BHD.,188624500.00,Keperluan Mendesak,25/02/2013
"PROGRAM PERUMAHAN RAKYAT (PPR) JABATAN PERUMAHAN NEGARA, KPKT SECARA RUNDINGAN TERUS BAGI PPR AYER PANAS, MELAKA
BIL. UNIT : 500 UNIT
TEMPOH PEMBINAAN : 30 BULAN",KERJA,"KEMENTERIAN KESEJAHTERAAN BANDAR, PERUMAHAN DAN KERAJAAN TEMPATAN",JABATAN PERUMAHAN NEGARA,PERMATA REBANA SDN. BHD.,80000000.00,Keperluan Mendesak,25/02/2013
"PERMOHONAN PEROLEHAN SECARA RUNDINGAN TERUS BAGI SEWAAN PERALATAN DAN PENYELENGGARAAN SISTEM KEHADIRAN BIOMETRIK UNTUK KEMENTERIAN TENAGA, TEKNOLOGI HIJAU DAN AIR",PERKHIDMATAN BUKAN PERUNDING,"KEMENTERIAN TENAGA, TEKNOLOGI HIJAU DAN AIR",,KERSUMA NYATA SDN. BHD.,148000.00,"Satu Punca Bekalan/ Perkhidmatan (Pembuat/ Pemegang Frachais), Penyeragaman, Keperluan Mendesak",20/02/2013
PERMOHONAN KELULUSAN KEMENTERIAN KEWANGAN BAGI PEROLEHAN PERKHIDMATAN PENGURUSAN PROMOSI KEMENTERIAN PELAJARAN MALAYSIA (KPM) SECARA RUNDINGAN TERUS DENGAN MEDIA PRIMA BERHAD,BEKALAN DAN PERKHIDMATAN BUKAN PERUNDING,KEMENTERIAN PENDIDIKAN MALAYSIA,,MEDIA PRIMA BERHAD,26257694.86,Satu Punca Bekalan/ Perkhidmatan (Pembuat/ Pemegang Frachais),20/02/2013
PERMOHONAN PERUBAHAN SKOP GOVERNMENT REGIONAL ELECTRONIC ADVANCE TRANSFORMATION (GREAST) FASA 1,BEKALAN DAN PERKHIDMATAN BUKAN PERUNDING,JABATAN PERDANA MENTERI,UNIT PEMODENAN TADBIRAN & PERANCANGAN PENGURUSAN MALAYSIA (MAMPU),BRILLIANCE INFORMATION SDN BHD,375000.00,Keperluan Mendesak,14/02/2013
PERMOHONAN PEROLEHAN SECARA RUNDINGAN TERUS BAGI PERKHIDMATAN PENYELENGGARAAN SISTEM STANDARD ACCOUNTING FOR GOVERNMENT AGENCIES  (SAGA) UNTUK PERBADANAN HARTA INTELEK MALAYSIA (MYIPO),PERKHIDMATAN BUKAN PERUNDING,"KEMENTERIAN PERDAGANGAN DALAM NEGERI, KOPERASI DAN KEPENGGUNAAN",PERBADANAN HARTA INTELEK MALAYSIA,CENTURY SOFTWARE (MALAYSIA) SDN. BHD.,57000.00,"Penyeragaman, Satu Punca Bekalan/ Perkhidmatan (Pembuat/ Pemegang Frachais), Keperluan Mendesak",13/02/2013
"PERMOHONAN PEROLEHAN TAMBAHAN KUANTITI BAGI MEMBEKAL, MENGHANTAR, MEMASANG, MENGKONFIGURASI, MENGUJI DAN MENTAULIAH 2 UNIT MESIN PENGIMBAS BAGASI (ONE-OFF)",BEKALAN DAN PERKHIDMATAN BUKAN PERUNDING,JABATAN PERDANA MENTERI,UNIT PEMODENAN TADBIRAN & PERANCANGAN PENGURUSAN MALAYSIA (MAMPU),DINUAR SDN. BHD.,350000.00,Keperluan Mendesak,13/02/2013
"PERKHIDMATAN PENYELENGGARAAN PENCEGAHAN, PEMBAIKAN KEROSAKAN DAN PEMBEKALAN ALAT GANTI BAGI 6 UNIT MESIN PENGIMBAS RELOCATABLE VACIS II-CE DAN 1 UNIT MESIN PENGIMBAS PORTAL VACIS UNTUK JABATAN KASTAM DIRAJA MALAYSIA BAGI TEMPOH TIGA TAHUN MULAI 5 JUN 2015 HINGGA 4 JUN 2018",BEKALAN DAN PERKHIDMATAN BUKAN PERUNDING,KEMENTERIAN KEWANGAN,JABATAN KASTAM DIRAJA MALAYSIA,JURUPRO SDN. BHD.,11527309.20,"SATU PUNCA (BEKALAN), SATU PUNCA (PERKHIDMATAN)",23/02/2015
"PERMOHONAN KELULUSAN RUNDINGAN TERUS BAGI MEMBEKAL, MEMASANG DAN MENGUJIGUNA MESIN CHOPIN MIXOLAB 2 - A COMPREHENSIVE SYSTEM FOR RESEARCH AND QUALITY CONTROL OF FLOUR KE PUSAT PENYELIDIKAN TEKNOLOGI MAKANAN, IBU PEJABAT MARDI, SERDANG MULAI 4 MEI 2015 HINGGA 27 JULAI 2015",BEKALAN,KEMENTERIAN PERTANIAN DAN INDUSTRI ASAS TANI,INSTITUT PENYELIDIKAN DAN KEMAJUAN PERTANIAN MALAYSIA (MARDI),TRANSLAB (M) SDN.BHD.,234000.00,SATU PUNCA (BEKALAN),23/02/2015
PERMOHONAN KELULUSAN RUNDINGAN TERUS BAGI PERKHIDMATAN PEMBANGUNAN DAN PELAKSANAAN SISTEM SOKONGAN SAGA GST LEMBAGA PERTUBUHAN PELADANG DENGAN SAF PILIHAN SDN. BHD. BAGI TEMPOH SIAP/PENGHANTARAN PADA MINGGU KETIGA BULAN APRIL 2015,BEKALAN DAN PERKHIDMATAN BUKAN PERUNDING,KEMENTERIAN PERTANIAN DAN INDUSTRI ASAS TANI,LEMBAGA PERTUBUHAN PELADANG (LPP),SAF PILIHAN SDN. BHD.,100300.00,MENDESAK,18/02/2015
"MEMBEKAL, MENGHANTAR, MEMASANG, MENGUJILARI DAN MENTAULIAH ""VIRTUAL ISTUDIO VIRTUAL PRESENTATION AND RECORDING SYSTEM"" SECARA RUNDINGAN TERUS MELALUI 'ONE OFF'",BEKALAN,KEMENTERIAN PENDIDIKAN,UNIVERSITI TEKNIKAL MALAYSIA MELAKA,UNIVERSAL IT SOLUTIONS SDN. BHD.,122000.00,KEPAKARAN,06/02/2015
PELANTIKAN SYARIKAT SPEEDMINER SDN BHD (SSB) SECARA RUNDINGAN TERUS OLEH PERBADANAN PRODUKTIVITI MALAYSIA (MPC) BAGI CADANGAN DAN KELULUSAN PELAKSANAAN TAMBAHAN LESEN DAN MENAMBAHBAIK SISTEM PENGKALAN DATA DI MPC SELAMA 12 BULAN BERMULA APRIL 2015,PERKHIDMATAN BUKAN PERUNDING,KEMENTERIAN PERDAGANGAN ANTARABANGSA DAN INDUSTRI,PERBADANAN PRODUKTIVITI MALAYSIA (MPC),SPEEDMINER SDN. BHD.,99966.00,SATU PUNCA (PERKHIDMATAN),06/02/2015
PELANTIKAN SYARIKAT CENTURY SOFTWARE (M) SDN BHD SECARA RUNDINGAN TERUS OLEH PERBADANAN PRODUKTIVITI MALAYSIA (MPC) BAGI CADANGAN DAN KELULUSAN PEMBELIAN MODUL GST SAGA VERSI 8.2 UNTUK KEGUNAAN DI MPC  UNTUK TEMPOH PEROLEHAN 3 BULAN BERMULA APRIL 2015,PERKHIDMATAN BUKAN PERUNDING,KEMENTERIAN PERDAGANGAN ANTARABANGSA DAN INDUSTRI,PERBADANAN PRODUKTIVITI MALAYSIA (MPC),CENTURY SOFTWARE (MALAYSIA) SDN. BHD.,107016.00,SATU PUNCA (BEKALAN),06/02/2015
"PERMOHONAN KELULUSAN PEROLEHAN SECARA RUNDINGAN TERUS BAGI MENAIKTARAF, MENGUJI DAN MENTAULIAH SISTEM   WORKSTATION BAGI PERALATAN PERUBATAN BONE DENSITOMETER JENAMA HOLOGIC UNTUK JABATAN PENGIMEJAN DIAGNOSTIK HOSPITAL KUALA LUMPUR",BEKALAN,KEMENTERIAN KESIHATAN,HOSPITAL KUALA LUMPUR,MEDIKRAFT SDN. BHD.,89500.00,Satu Punca Bekalan/ Perkhidmatan (Pembuat/ Pemegang Frachais),29/01/2015
PEROLEHAN SECARA RUNDINGAN TERUS DENGAN UNIVERSITI PENDIDIKAN SULTAN IDRIS (UPSI) BAGI MELAKSANAKAN KURSUS AMALI SAINS PEMBANTU MAKMAL PERKHIDMATAN BUKAN GURU KEMENTERIAN PENDIDIKAN MALAYSIA MULAI MAC 2015 HINGGA SEPTEMBER 2015,PERKHIDMATAN BUKAN PERUNDING,KEMENTERIAN PENDIDIKAN,TIADA AGENSI,UNIVERSITI PENDIDIKAN SULTAN IDRIS (UPSI),2979848.40,"MENDESAK, PENYERAGAMAN, KEPAKARAN",21/01/2015
PERMOHONAN PEROLEHAN PERKHIDMATAN SOKONGAN TEKNIKAL DAN PENYELENGGARAAN PERISIAN SISTEM PENGURUSAN DESKTOP TCO!STREAM DI LEMBAGA HASIL DALAM NEGERI MALAYSIA (LHDNM) SECARA RUNDINGAN TERUS DENGAN SYARIKAT WORLDTECH SOLUTIONS SDN. BHD BAGI TEMPOH DUA  TAHUN MULAI 1 MAC 2015 HINGGA 28 FEBRUARI 2017,PERKHIDMATAN BUKAN PERUNDING,KEMENTERIAN KEWANGAN,LEMBAGA HASIL DALAM NEGERI (LHDN),WORLDTECH SOLUTIONS SDN. BHD.,1496000.00,SATU PUNCA (PERKHIDMATAN),20/01/2015
"PERMOHONAN KELULUSAN PERTAMBAHAN KUANTITI BAGI PEROLEHAN SECARA RUNDINGAN TERUS MEMBEKAL, MENGHANTAR, MEMASANG, MENGKONFIGURASI, MENGUJI DAN MENTAULIAH 2 UNIT MESIN PENGIMBAS BAGASI",BEKALAN DAN PERKHIDMATAN BUKAN PERUNDING,JABATAN PERDANA MENTERI,,DINUAR SDN. BHD.,340000.00,Keperluan Mendesak,13/02/2013
PERMOHONAN RUNDINGAN TERUS BAGI PELANTIKAN KMF MALAYSIAWE SEBAGAI PEMBEKAL PERKHIDMATAN UNTUK PERSIAPAN LOGISTIK DAN KEPERLUAN TEKNIKAL SEMPENA PROGRAM MINGGU BUDAYA MALAYSIA PARIS 2015,BEKALAN DAN PERKHIDMATAN BUKAN PERUNDING,KEMENTERIAN PELANCONGAN DAN KEBUDAYAAN MALAYSIA,TIADA AGENSI,KMF MALAYSIAWE,3232777.00,"BUMIPUTERA (PEMBUAT), KEPAKARAN",19/01/2015
"PERMOHONAN KELULUSAN PEROLEHAN PERKHIDMATAN 
PENYENGGARAAN DAN SOKONGAN BERKAITAN EMC CENTERA 96 NODES, APPLICATIONXTENDER, DISKXTENDER DAN REPLISTOR DI LEMBAGA HASIL DALAM NEGERI MALAYSIA BAGI TEMPOH SATU (1) TAHUN.",BEKALAN DAN PERKHIDMATAN BUKAN PERUNDING,KEMENTERIAN KEWANGAN,LEMBAGA HASIL DALAM NEGERI (LHDN),IKHLAS INFORMASI TEKNOLOGI SDN. BHD.,2310000.00,"Keperluan Mendesak, Penyeragaman",07/02/2013
PERMOHONAN PEROLEHAN SECARA RUNDINGAN TERUS DENGAN SYARIKAT ING PUBLIC TAKAFUL EHSAN BERHAD BAGI MENDAPATKAN PERKHIDMATAN PELAKSANAAN KEMUDAHAN INSURANS PERUBATAN DAN RAWATAN KLINIK PESAKIT LUAR KEPADA PEKERJA PERBADANAN HARTA INTELK MALAYSIA,PERKHIDMATAN BUKAN PERUNDING,"KEMENTERIAN PERDAGANGAN DALAM NEGERI, KOPERASI DAN KEPENGGUNAAN",PERBADANAN HARTA INTELEK MALAYSIA,ING PUBLIC TAKAFUL EHSAN BERHAD,394837.59,Kepakaran,05/02/2013
